{"$schema":"https://json-schema.org/draft/2020-12/schema","$id":"https://github.com/thedanieltan/financial-model-router-oss/blob/main/fmr/contracts/model-acceptance-corpus.v1.schema.json","title":"FMR model acceptance corpus v1","type":"object","required":["contract_version","corpus_id","cases","practitioner_reviews"],"properties":{"contract_version":{"const":"model-acceptance-corpus.v1"},"corpus_id":{"type":"string","minLength":1},"cases":{"type":"array","minItems":1,"items":{"type":"object","required":["case_id","data_classification","job","canonical_input","assertions"],"properties":{"case_id":{"type":"string","minLength":1},"data_classification":{"enum":["synthetic","anonymized"]},"job":{"type":"object"},"canonical_input":{"type":"object"},"assertions":{"type":"array","minItems":1,"items":{"type":"object","required":["assertion_id","path","operator","expected"],"properties":{"assertion_id":{"type":"string","minLength":1},"path":{"type":"string","minLength":1},"operator":{"enum":["equals","approximately_equals","greater_than_or_equal","less_than_or_equal"]},"expected":{},"tolerance":{}},"additionalProperties":false}}},"additionalProperties":false}},"practitioner_reviews":{"type":"array","items":{"type":"object","required":["model_family","reviewer_role","status","evidence_reference"],"properties":{"model_family":{"type":"string","minLength":1},"reviewer_role":{"type":"string","minLength":1},"status":{"enum":["accepted","rejected"]},"evidence_reference":{"type":"string","minLength":1}},"additionalProperties":false}}},"additionalProperties":false}
